{
  "schema_version": "starlight.experience_standard.v1",
  "reviewed_at": "2026-09-30",
  "scope": "Design requirements and a bounded upgrade queue for the 14 registered portfolio surfaces. These proposed jobs and dated observations do not establish adoption, brand approval or production quality.",
  "policy": {
    "identity_authority": "existing-brand-packs-and-recorded-owner-decisions",
    "reference_rights": "third-party-reference-only",
    "production_claim": "none",
    "typography_dependency": "https://github.com/frankxai/starlight-design-intelligence/pull/22"
  },
  "checks": [
    {
      "id": "task",
      "requirement": "One recipient, one user job and one bounded next action.",
      "acceptance": [
        "A first-time user can identify the job, actual availability and consequence before committing.",
        "The primary journey reaches a saved, inspectable or usable outcome with actual content."
      ],
      "evidence": [
        "Record task completion, elapsed time, error count and a qualitative user observation; set a baseline before claiming improvement."
      ],
      "gate_paths": [
        "evals/ui-quality-scorecard.md",
        "evals/editorial-articulation-gate.md"
      ]
    },
    {
      "id": "proof",
      "requirement": "Important claims resolve to inspectable, dated evidence.",
      "acceptance": [
        "Place the source or owned artifact beside each consequential claim.",
        "Distinguish live, prototype, sample, customer-reported and proposed evidence; remove unsupported claims."
      ],
      "evidence": [
        "A route-by-route claim ledger with source date, rights, consent and limitations."
      ],
      "gate_paths": [
        "evals/editorial-articulation-gate.md",
        "evals/web-release-gate.md"
      ]
    },
    {
      "id": "states",
      "requirement": "Every consequential action has complete, recoverable states.",
      "acceptance": [
        "Exercise loading, empty, error, success, disabled and unavailable states where applicable.",
        "A failed request preserves input and offers a specific recovery; retries do not duplicate a purchase or submission.",
        "Explain credit use, data destination, consent and irreversible consequences before action."
      ],
      "evidence": [
        "A journey recording and state matrix covering normal, slow-network, denied-permission and failed-request paths."
      ],
      "gate_paths": [
        "evals/ui-quality-scorecard.md",
        "evals/web-release-gate.md"
      ]
    },
    {
      "id": "accessibility",
      "requirement": "The full task remains usable on a phone and without a pointer.",
      "acceptance": [
        "Complete the primary task by keyboard with visible focus, logical order and understandable labels.",
        "Verify 1440px desktop, 390px phone, 320px reflow and 200% zoom with long real content.",
        "Verify contrast, text alternatives and semantic errors; record manual checks as well as automated findings."
      ],
      "evidence": [
        "Scoped accessibility report, manual keyboard result and screenshots of each required viewport."
      ],
      "gate_paths": [
        "evals/web-release-gate.md",
        "evals/ui-quality-scorecard.md"
      ]
    },
    {
      "id": "typography",
      "requirement": "Use the chosen brand roles with real loaded fonts and readable copy.",
      "acceptance": [
        "Use sentence case and real lowercase; preserve proper names, genuine acronyms, code and existing wordmarks.",
        "Use actual licensed weights and styles; inspect fallback, slow loading, long names and clipping in the exported artifact.",
        "Preserve existing owner selections; PR22 recommendations remain proposals until recorded approval."
      ],
      "evidence": [
        "Exact font provenance, computed-font report, mobile specimen and export inspection."
      ],
      "gate_paths": [
        "evals/typography-quality-gate.md"
      ]
    },
    {
      "id": "motion",
      "requirement": "Motion explains an actual state or relationship and keeps control responsive.",
      "acceptance": [
        "Name the job of every shipped sequence and retain a complete static journey.",
        "Verify reduced-motion equivalence, interruptibility and intentionally composed phone behavior.",
        "Measure layout stability, loading and input responsiveness on the actual route; decoration cannot delay the primary task."
      ],
      "evidence": [
        "Purpose decision, performance report and decoded motion/reduced-motion evidence required by the existing release validator."
      ],
      "gate_paths": [
        "evals/motion-purpose-gate.md",
        "evals/web-release-gate.md"
      ]
    },
    {
      "id": "portability",
      "requirement": "Users can return to, share and use the artifact they created.",
      "acceptance": [
        "Exercise save, reopen, share and download when the surface promises them.",
        "Verify exported text, fonts, crops, rights and links in the actual download or native share destination.",
        "Never publish placeholder contact details, stale offer dates or an unapproved identity."
      ],
      "evidence": [
        "Reopened artifact and inspected export with source revision, rights, claim date and usage record."
      ],
      "gate_paths": [
        "evals/generated-asset-quality-gate.md",
        "evals/typography-quality-gate.md"
      ]
    },
    {
      "id": "release",
      "requirement": "A structurally valid plan does not constitute a verified experience.",
      "acceptance": [
        "Keep maker, independent verifier and named approver separate for public flagship releases.",
        "Use the existing release gate and adoption validator; retain all existing numerical bars and evidence requirements.",
        "Record preview checks before promotion and scoped production verification plus an exact rollback after deployment."
      ],
      "evidence": [
        "The existing content-addressed release bundle and independent verdict in the owning product repository."
      ],
      "gate_paths": [
        "evals/web-release-gate.md"
      ]
    }
  ],
  "tool_reviews": [
    {
      "id": "github.2026-09-30",
      "tool": "github",
      "reviewed_at": "2026-09-30",
      "evidence_kind": "repository-inspection",
      "scope": "Canonical design repository main at c7a58f112b46ddd8ba85844ba03c31a1308bc5eb and open draft typography PR22 at 7cccfcc8c1752eb6e621f99392f096e17ee1ee03.",
      "observations": [
        "The existing registry covers 11 brand/domain profiles, 13 owning repositories and 14 surfaces.",
        "PR22 adds typography guidance, font evidence and specimens; it remains a separate open draft."
      ],
      "limitations": [
        "Registry coverage is not downstream adoption or production proof.",
        "Domain direction nominations do not constitute identity approval; typography candidates do not replace owner decisions."
      ],
      "next_action": "Validate the shared experience requirements and export a source-pinned brand handoff before changing a product or tool."
    },
    {
      "id": "figma.2026-09-30",
      "tool": "figma",
      "reviewed_at": "2026-09-30",
      "evidence_kind": "private-read-only-audit",
      "scope": "Seven scoped design files and repository links were inspected. One additional file hit the account tool quota; two boards remain unverified.",
      "observations": [
        "The inspected FrankX foundation has 60 variables in four one-mode collections, 14 text styles and five effect styles.",
        "No local components were found on the inspected FrankX pages; its overview capture did not form a usable design-system specimen.",
        "The inspected Arcanea master and two GenCreator files contained no owned local system content; vendor references are separate."
      ],
      "limitations": [
        "This is a scoped audit, not an account-wide inventory.",
        "The Starter plan tool quota blocked further inspection; Code Connect eligibility requires a separate plan decision.",
        "Counts do not verify token source parity, font bytes, component behavior or library publication."
      ],
      "next_action": "Generate the committed source projection; reconcile identity conflicts; build and verify one desktop and phone flow before publishing its first component family."
    },
    {
      "id": "canva.2026-09-30",
      "tool": "canva",
      "reviewed_at": "2026-09-30",
      "evidence_kind": "private-read-only-audit",
      "scope": "Read-only account inventory and selected design text were audited; most designs were not visually reviewed. Private kit names and tool identifiers remain outside public Git.",
      "observations": [
        "The audit returned 337 unique designs, 1454 images, 68 folders, 28 empty folders, six kits and one published Brand Template.",
        "Folder spines existed but several operating folders were empty.",
        "Selected decks and reports contained dated claims or placeholder contact details requiring review before reuse."
      ],
      "limitations": [
        "Kit names do not establish their brand relationship, contents, font rights or approval.",
        "Template datasets did not establish a fillable automation workflow; exported visual quality and sync were not verified.",
        "Repeated titles alone do not prove duplicate content."
      ],
      "next_action": "Pilot one approved brand kit and two locked content templates; inspect real exports and register approved media before wider migration."
    }
  ],
  "references": [
    {
      "id": "linear.text.2026-09-30",
      "target_id": "linear",
      "source_url": "https://linear.app/",
      "reviewed_at": "2026-09-30",
      "evidence_kind": "primary-page-text",
      "rights": "third-party-reference-only",